{
  "$schema": "../../schemas/catalog-metadata.v1.schema.json",
  "schemaVersion": 1,
  "identity": {
    "kind": "service",
    "id": "deepl-translate"
  },
  "presentation": {
    "defaultLocale": "zh-CN",
    "i18n": {
      "zh-CN": {
        "name": "DeepL 翻译",
        "summary": "高质量多语言翻译服务，支持 35+ 语言互译和文档翻译"
      },
      "en-US": {
        "name": "DeepL Translation",
        "summary": "High-quality multilingual translation service supporting 35+ languages and document translation"
      }
    },
    "tags": [
      "翻译",
      "多语言",
      "NLP"
    ]
  },
  "release": {
    "state": "known",
    "version": "2.0",
    "versionScheme": "opaque"
  },
  "timestamps": {
    "catalogUpdatedAt": {
      "state": "known",
      "value": "2026-03-09",
      "precision": "day"
    },
    "releasePublishedAt": {
      "state": "unknown"
    },
    "reviewedAt": {
      "state": "unknown"
    },
    "upstreamObservedAt": {
      "state": "unknown"
    }
  },
  "provenance": {},
  "governance": {
    "availability": "listing-only",
    "license": {
      "state": "unknown"
    },
    "redistribution": "verify-package-terms",
    "upstreamMaintainer": {
      "name": "DeepL",
      "verified": false
    }
  },
  "compatibility": {
    "platforms": {
      "state": "known",
      "values": [
        "macos",
        "windows",
        "linux"
      ]
    }
  },
  "spec": {
    "kind": "service",
    "protocol": "http",
    "authType": "unknown",
    "capabilities": [
      "text_translate",
      "doc_translate",
      "language_detect"
    ]
  }
}
